{
  "format": "worldir-godot-artlab-realization-policy-v1",
  "source": {
    "project": "WorldIR Godot ArtLab V2",
    "scope": "backend_owned_realization_only",
    "world_ir_contract_unchanged": true
  },
  "terrain": {
    "region_roles": {
      "forest_surface": ["forest", "swamp"],
      "settlement_surface": ["town", "village", "district"],
      "coast_surface": ["coast"]
    },
    "geometry": {
      "base_height_limit_m": 2.8,
      "forest_height_limit_m": 3.55,
      "forest_relief_strength": 0.78,
      "settlement_flatten_strength": 0.82,
      "broad_x_frequency": 0.027,
      "broad_x_amplitude_m": 1.05,
      "broad_z_frequency": 0.023,
      "broad_z_amplitude_m": 0.85,
      "broad_diagonal_frequency": 0.014,
      "broad_diagonal_amplitude_m": 0.65,
      "detail_x_frequency": 0.071,
      "detail_z_frequency": 0.043,
      "detail_first_amplitude_m": 0.32,
      "detail_second_x_frequency": 0.049,
      "detail_second_z_frequency": 0.061,
      "detail_second_amplitude_m": 0.24,
      "forest_first_x_frequency": 0.041,
      "forest_first_z_frequency": 0.026,
      "forest_first_amplitude_m": 0.56,
      "forest_second_x_frequency": 0.019,
      "forest_second_z_frequency": 0.044,
      "forest_second_amplitude_m": 0.42,
      "forest_detail_multiplier": 0.48
    },
    "influences": {
      "region_outer_blend_m": 3.5,
      "region_inner_blend_m": 5.5,
      "road_shoulder_m": 2.6,
      "road_terrain_blend_m": 3.4,
      "building_dirt_fade_m": 2.3,
      "building_flatten_blend_m": 2.8,
      "building_path_max_length_m": 26.0,
      "building_path_surface_inner_m": 0.55,
      "building_path_surface_outer_m": 1.45,
      "coast_beach_blend_start_m": -18.0,
      "coast_beach_blend_end_m": -5.0,
      "coast_land_blend_m": 12.0,
      "coast_wet_sand_m": 4.5,
      "coast_underwater_slope": 0.035,
      "coast_land_height_above_sea_m": 0.62,
      "coast_shore_height_offset_m": -0.06,
      "coast_underwater_height_offset_m": -0.14,
      "coast_max_underwater_drop_m": 1.8
    }
  },
  "surface": {
    "palette": {
      "meadow_low": [0.19, 0.245, 0.125],
      "meadow_high": [0.255, 0.305, 0.155],
      "forest_green_low": [0.105, 0.17, 0.07],
      "forest_green_high": [0.17, 0.235, 0.105],
      "forest_soil": [0.255, 0.18, 0.095],
      "packed_dirt_low": [0.31, 0.235, 0.135],
      "packed_dirt_high": [0.38, 0.285, 0.16],
      "sand_low": [0.43, 0.405, 0.265],
      "sand_high": [0.52, 0.485, 0.315],
      "wet_sand_low": [0.245, 0.255, 0.19],
      "wet_sand_high": [0.31, 0.295, 0.205],
      "road_dirt_low": [0.285, 0.205, 0.115],
      "road_dirt_high": [0.355, 0.265, 0.145]
    },
    "forest_soil_patch_start": 0.61,
    "forest_soil_patch_end": 0.79,
    "forest_soil_patch_strength": 0.58,
    "settlement_blend_strength": 0.82,
    "wet_sand_blend_strength": 0.88,
    "road_blend_strength": 0.86,
    "variation_min": 0.94,
    "variation_max": 1.06,
    "roughness": 1.0,
    "specular": 0.08
  },
  "dressing": {
    "density_semantics": "candidate_placement_times_acceptance_probability_times_spatial_influences",
    "region_types": ["forest"],
    "candidate_attempts": 140,
    "cluster_sample_probability": 0.82,
    "cluster_center_attempts": 96,
    "cluster_center_minimum_separation_m": 8.0,
    "cluster_separation_score_distance_m": 14.0,
    "cluster_profile_score_weight": 0.70,
    "edge_profiles": {
      "edge": {
        "minimum_multiplier": 0.08,
        "outer_ramp_start_m": 0.2,
        "outer_ramp_end_m": 2.5,
        "interior_falloff_start_m": 8.0,
        "interior_falloff_end_m": 22.0
      },
      "interior": {
        "minimum_multiplier": 0.05,
        "ramp_start_m": 5.0,
        "ramp_end_m": 16.0
      },
      "mixed": {
        "minimum_multiplier": 0.55,
        "falloff_start_m": 10.0,
        "falloff_end_m": 26.0
      }
    },
    "layers": {
      "dead_tree": {
        "target_area_per_candidate_m2": 456.0,
        "acceptance_probability": 0.12,
        "legacy_area_per_instance_m2": 3800.0,
        "cap": 4,
        "cluster_count": 0,
        "cluster_radius_m": 0.0,
        "edge_mode": "interior",
        "road_clearance_m": 2.0
      },
      "rock": {
        "target_area_per_candidate_m2": 171.6,
        "acceptance_probability": 0.22,
        "legacy_area_per_instance_m2": 780.0,
        "cap": 18,
        "cluster_count": 3,
        "cluster_radius_m": 3.8,
        "edge_mode": "mixed",
        "road_clearance_m": 1.5
      },
      "bush": {
        "target_area_per_candidate_m2": 130.0,
        "acceptance_probability": 0.52,
        "legacy_area_per_instance_m2": 250.0,
        "cap": 55,
        "cluster_count": 5,
        "cluster_radius_m": 6.0,
        "edge_mode": "edge",
        "road_clearance_m": 1.0
      },
      "grass": {
        "target_area_per_candidate_m2": 77.0,
        "acceptance_probability": 0.77,
        "legacy_area_per_instance_m2": 100.0,
        "cap": 120,
        "cluster_count": 7,
        "cluster_radius_m": 7.0,
        "edge_mode": "edge",
        "road_clearance_m": 0.55
      }
    },
    "building_clearing": {
      "minimum_inner_radius_m": 4.0,
      "minimum_outer_radius_m": 12.0,
      "footprint_inner_scale": 1.6,
      "footprint_outer_scale": 3.0,
      "minimum_multiplier": {
        "dead_tree": 0.20,
        "rock": 0.65,
        "bush": 0.16,
        "grass": 0.12
      }
    },
    "network_corridors": {
      "road": {
        "outer_extra_width_m": 5.2,
        "minimum_multiplier": {
          "dead_tree": 0.35,
          "rock": 0.55,
          "bush": 0.10,
          "grass": 0.08
        }
      },
      "path": {
        "outer_extra_width_m": 2.55,
        "minimum_multiplier": {
          "dead_tree": 0.45,
          "rock": 0.65,
          "bush": 0.12,
          "grass": 0.10
        }
      }
    }
  }
}
